{
  "name": "noir_low_key",
  "kind": "lighting",
  "version": 1,
  "description": "Hard single-source key, deep shadows, minimal fill. Separation rim on the subject's shoulder. Black-and-white-adjacent grade will read as noir even in colour.",
  "inputs_required": [],
  "outputs_produced": ["lighting_preset"],
  "applies": {
    "preset_name": "studio_five_point",
    "hdri_keywords": ["night", "dark", "interior", "low_key"],
    "time_of_day_hint": "night",
    "key_energy_multiplier": 1.1,
    "rim_light": true,
    "ambient_intensity": 0.05
  },
  "metadata": {
    "author": "team",
    "inspiration": "Double Indemnity; Sin City palette restraint",
    "quality_tier": "hero"
  },
  "renderer_support": {"blender_eevee": "native", "blender_cycles": "native", "unreal": "pending"}
}
