{
  "name": "establishing_wide",
  "kind": "composition",
  "version": 1,
  "description": "Classic establishing shot: hero small in frame, environment dominant. 35mm lens at ~10x hero-diagonal distance, slight downward pitch so the ridge/horizon sits on the upper third.",
  "inputs_required": ["hero_root"],
  "outputs_produced": ["camera_preset"],
  "applies": {
    "preset_name": "wide_establishing",
    "shot_type": "establishing",
    "lens_mm": 35,
    "distance_multiplier": 10.0,
    "angle_pitch_deg": -2,
    "angle_yaw_deg": 5,
    "height_above_hero_m": 0.8,
    "target_offset": [0.0, 0.0, 0.2],
    "subject_screen_position": "center_low"
  },
  "metadata": {
    "author": "team",
    "inspiration": "Lawrence of Arabia, Malick landscape openers",
    "quality_tier": "hero"
  },
  "renderer_support": {
    "blender_eevee": "native",
    "blender_cycles": "native",
    "unreal": "pending"
  }
}
