{
  "name": "desert_dune",
  "kind": "environment",
  "version": 1,
  "description": "Sand-dune sea stretching to the horizon. Hero stands on a ridge line; the sun rakes low; the ground material is warm and slightly reflective to catch heat haze.",
  "inputs_required": ["forced_environment_entry"],
  "outputs_produced": ["environment_preset"],
  "applies": {
    "preset_name": "terrain_blend",
    "ground_material": "sand_warm",
    "horizon_treatment": "atmospheric_falloff"
  },
  "metadata": {
    "author": "team",
    "inspiration": "Lawrence of Arabia; Dune (2021) exteriors",
    "quality_tier": "hero"
  },
  "renderer_support": {"blender_eevee": "native", "blender_cycles": "native", "unreal": "pending"}
}
