{
  "name": "push_in_hero",
  "kind": "composition",
  "version": 1,
  "description": "Classic emotional push-in. Camera starts at medium distance and slowly dollies toward the hero over the full shot length. 45mm lens so features stay natural. Wraps the existing V1.1 `hero_push_in` preset, extended with the shot-type hint so Phase 5 can drive the `camera_push_in` motion profile.",
  "inputs_required": ["hero_root"],
  "outputs_produced": ["camera_preset"],
  "applies": {
    "preset_name": "hero_push_in",
    "shot_type": "push_in",
    "lens_mm": 45,
    "distance_multiplier": 5.5,
    "distance_multiplier_end": 2.2,
    "angle_pitch_deg": -1,
    "angle_yaw_deg": 5,
    "height_above_hero_m": 0.3,
    "target_offset": [0.0, 0.0, 0.4],
    "subject_screen_position": "center"
  },
  "metadata": {
    "author": "team",
    "inspiration": "Spielberg reveal pushes; Denis Villeneuve hero intros",
    "quality_tier": "hero"
  },
  "renderer_support": {"blender_eevee": "native", "blender_cycles": "native", "unreal": "pending"}
}
