{
  "name": "city_street",
  "kind": "environment",
  "version": 1,
  "description": "Urban street corridor: wet asphalt, neon bloom, distant building silhouettes softened by fog. Works for city-night renders and vehicle hero shots where the hero should feel embedded in the street, not placed on top of it.",
  "inputs_required": ["forced_environment_entry"],
  "outputs_produced": ["environment_preset"],
  "applies": {
    "preset_name": "city_fog",
    "ground_material": "asphalt_wet",
    "horizon_treatment": "neon_bloom_haze"
  },
  "metadata": {
    "author": "team",
    "inspiration": "Blade Runner 2049; Drive (2011); Neo Tokyo imagery",
    "quality_tier": "hero"
  },
  "renderer_support": {"blender_eevee": "native", "blender_cycles": "native", "unreal": "pending"}
}
