{
  "name": "canyon_floor",
  "kind": "environment",
  "version": 1,
  "description": "Red-rock canyon as backdrop. Hero sits on the canyon floor; walls rise on both flanks; the horizon line escapes through a slot between ridges. Works for flat_map canyon textures (auto-ground-replaced) and 3d_terrain canyons (raycast surface).",
  "inputs_required": ["forced_environment_entry"],
  "outputs_produced": ["environment_preset"],
  "applies": {
    "preset_name": "terrain_blend",
    "ground_material": "red_rock_dust",
    "horizon_treatment": "slot_between_ridges"
  },
  "metadata": {
    "author": "team",
    "inspiration": "Ford Westerns; Moab / Monument Valley photography",
    "quality_tier": "hero"
  },
  "renderer_support": {"blender_eevee": "native", "blender_cycles": "native", "unreal": "pending"}
}
