{
  "name": "cinematic_moody",
  "kind": "lighting",
  "version": 1,
  "description": "Desaturated cool-with-warm-accent key; 3:1 key-to-fill ratio; strong rim to separate hero silhouette from dark backdrop. Used for night exteriors and any prompt containing 'moody', 'noir-ish', 'dramatic'.",
  "inputs_required": [],
  "outputs_produced": ["lighting_preset"],
  "applies": {
    "preset_name": "neon_city",
    "hdri_keywords": ["dusk", "overcast", "cloudy", "stormy", "moody"],
    "time_of_day_hint": "dusk",
    "key_energy_multiplier": 0.9,
    "rim_light": true,
    "ambient_intensity": 0.18
  },
  "metadata": {
    "author": "team",
    "inspiration": "Deakins 1917 night exteriors; Chivo Birdman interiors",
    "quality_tier": "hero"
  },
  "renderer_support": {"blender_eevee": "native", "blender_cycles": "native", "unreal": "pending"}
}
